{
  "capability_id": "cap-secure-consensus-transport",
  "declaration": {
    "name": "Transport consensus sécurisé",
    "description": "Chiffrement/authentification du transport Raft.",
    "invariants_required": [
      "I8"
    ],
    "deployment_perimeter": {
      "HOST_SCOPE": "multi-host",
      "CONCURRENCY": "distributed-consensus"
    }
  },
  "evidence": {
    "implementation_version": "5.6.1",
    "test_version": "0.6.0",
    "test_results_hash": "0000000000000000000000000000000000000000000000000000000000000000",
    "test_command": "n/a"
  },
  "demonstration_scope": null,
  "status_note": "RÉFUTÉ : transport non durci.",
  "limitations": {
    "known_limits": [
      "FM-20 ouvert",
      "pickle non authentifié"
    ]
  },
  "validation": {
    "structural_admissibility": true,
    "effective_guarantee_demonstrated": false,
    "verification_timestamp": "2026-10-21T07:29:00Z"
  }
}
