{
  "capability_id": "cap-dedup-consensus-registry",
  "declaration": {
    "name": "Déduplication registre consensus",
    "description": "Registre de déduplication répliqué via Raft.",
    "invariants_required": [
      "I2"
    ],
    "deployment_perimeter": {
      "HOST_SCOPE": "multi-host",
      "CONCURRENCY": "distributed-consensus"
    }
  },
  "evidence": {
    "implementation_version": "5.6.1",
    "test_version": "0.6.0",
    "test_results_hash": "0000000000000000000000000000000000000000000000000000000000000000",
    "test_command": "pytest -q tests/raft/test_registry.py"
  },
  "demonstration_scope": "loopback-test-only",
  "status_note": "Démontré en test loopback.",
  "limitations": {
    "known_limits": [
      "périmètre loopback",
      "FM-20"
    ]
  },
  "validation": {
    "structural_admissibility": true,
    "effective_guarantee_demonstrated": true,
    "verification_timestamp": "2026-10-21T07:29:00Z"
  }
}
