{
  "capability_id": "cap-exactly-once-external",
  "declaration": {
    "name": "Exactly-once externe",
    "description": "Un seul effet externe par décision.",
    "invariants_required": [
      "I2"
    ],
    "deployment_perimeter": {
      "HOST_SCOPE": "multi-host",
      "CONCURRENCY": "distributed-consensus"
    }
  },
  "evidence": {
    "implementation_version": "5.6.1",
    "test_version": "0.6.0",
    "test_results_hash": "0000000000000000000000000000000000000000000000000000000000000000",
    "test_command": "n/a"
  },
  "demonstration_scope": null,
  "status_note": "RÉFUTÉ : gouverné, pas prouvé.",
  "limitations": {
    "known_limits": [
      "états gouvernés seulement (UNKNOWN/HOLD)"
    ]
  },
  "validation": {
    "structural_admissibility": true,
    "effective_guarantee_demonstrated": false,
    "verification_timestamp": "2026-10-21T07:29:00Z"
  }
}
