{
  "capability_id": "cap-dedup-provider-key",
  "declaration": {
    "name": "Déduplication par clé provider",
    "description": "Idempotence déléguée au provider externe.",
    "invariants_required": [
      "I2"
    ],
    "deployment_perimeter": {
      "HOST_SCOPE": "mono-host",
      "CONCURRENCY": "file-lock"
    }
  },
  "evidence": {
    "implementation_version": "5.6.1",
    "test_version": "0.6.0",
    "test_results_hash": "0000000000000000000000000000000000000000000000000000000000000000",
    "test_command": "n/a (preuve externe requise)"
  },
  "demonstration_scope": null,
  "status_note": "NON évalué : exactement-once externe non prouvé.",
  "limitations": {
    "known_limits": [
      "dépend des sémantiques du provider"
    ]
  },
  "validation": {
    "structural_admissibility": true,
    "effective_guarantee_demonstrated": null,
    "verification_timestamp": "2026-10-21T07:29:00Z"
  }
}
