{
  "capability_id": "cap-linearizability-verification",
  "declaration": {
    "name": "Vérification de linéarisabilité",
    "description": "Preuve C1 par checker formel.",
    "invariants_required": [
      "I8"
    ],
    "deployment_perimeter": {
      "HOST_SCOPE": "multi-host",
      "CONCURRENCY": "distributed-consensus"
    }
  },
  "evidence": {
    "implementation_version": "5.6.1",
    "test_version": "0.6.0",
    "test_results_hash": "0000000000000000000000000000000000000000000000000000000000000000",
    "test_command": "pytest -q tests/raft/test_linearizability.py"
  },
  "demonstration_scope": null,
  "status_note": "RÉFUTÉ en l'état : ne pas citer comme preuve C1.",
  "limitations": {
    "known_limits": [
      "checker prototype (F-03)",
      "comparaison status-only",
      "specs raccourcies"
    ]
  },
  "validation": {
    "structural_admissibility": true,
    "effective_guarantee_demonstrated": false,
    "verification_timestamp": "2026-10-21T07:29:00Z"
  }
}
